,number,value,datetime_start,datetime_complete,duration,params_activation_l0,params_activation_l1,params_activation_l2,params_lr,params_n_units_l0,params_n_units_l1,params_n_units_l2,state
0,0,0.11772239208221436,2024-07-25 13:25:23.282589,2024-07-25 13:25:48.689320,0 days 00:00:25.406731,sigmoid,elu,elu,0.00016051141239153282,163,805,618,COMPLETE
1,1,0.0789547860622406,2024-07-25 13:25:48.694149,2024-07-25 13:26:12.251306,0 days 00:00:23.557157,sigmoid,sigmoid,elu,0.0004850862802331533,374,150,957,COMPLETE
2,2,0.05915480852127075,2024-07-25 13:26:12.254390,2024-07-25 13:26:37.984628,0 days 00:00:25.730238,tanh,elu,sigmoid,0.00013760406407370857,535,409,322,COMPLETE
3,3,0.15430830419063568,2024-07-25 13:26:37.989228,2024-07-25 13:27:04.028162,0 days 00:00:26.038934,sigmoid,elu,tanh,0.0009010986098190771,633,800,907,COMPLETE
4,4,0.08368927240371704,2024-07-25 13:27:04.029895,2024-07-25 13:27:29.084209,0 days 00:00:25.054314,elu,elu,tanh,0.00025617725296510406,861,934,422,COMPLETE
5,5,0.09580172598361969,2024-07-25 13:27:29.085961,2024-07-25 13:27:53.885026,0 days 00:00:24.799065,sigmoid,sigmoid,sigmoid,0.002163752983084378,784,508,294,COMPLETE
6,6,0.1283739060163498,2024-07-25 13:27:53.886775,2024-07-25 13:28:18.713258,0 days 00:00:24.826483,sigmoid,sigmoid,sigmoid,0.0034961919638546893,773,632,580,COMPLETE
7,7,0.11358930170536041,2024-07-25 13:28:18.715021,2024-07-25 13:28:43.592047,0 days 00:00:24.877026,elu,sigmoid,sigmoid,0.0035568797088011226,261,729,854,COMPLETE
8,8,0.08414813876152039,2024-07-25 13:28:43.593865,2024-07-25 13:29:08.331336,0 days 00:00:24.737471,tanh,elu,tanh,0.00021971539130949367,600,276,755,COMPLETE
9,9,0.08152920007705688,2024-07-25 13:29:08.333034,2024-07-25 13:29:33.154228,0 days 00:00:24.821194,sigmoid,sigmoid,tanh,0.00015294549308892652,727,346,965,COMPLETE
10,10,0.0876208171248436,2024-07-25 13:29:33.155958,2024-07-25 13:29:57.733174,0 days 00:00:24.577216,tanh,tanh,sigmoid,0.0006753188789211478,995,454,140,COMPLETE
11,11,0.0841752216219902,2024-07-25 13:29:57.734935,2024-07-25 13:30:21.694033,0 days 00:00:23.959098,tanh,tanh,elu,0.00045041440875255605,399,138,381,COMPLETE
12,12,0.07377956062555313,2024-07-25 13:30:21.695734,2024-07-25 13:30:46.579343,0 days 00:00:24.883609,tanh,sigmoid,elu,0.00045558358269521463,417,135,700,COMPLETE
13,13,0.061404455453157425,2024-07-25 13:30:46.581321,2024-07-25 13:31:09.748349,0 days 00:00:23.167028,tanh,elu,elu,0.00010122659021603099,453,331,733,COMPLETE
14,14,0.05554051324725151,2024-07-25 13:31:09.750088,2024-07-25 13:31:33.959434,0 days 00:00:24.209346,tanh,elu,sigmoid,0.00011409676280729667,483,364,469,COMPLETE
15,15,0.10087708383798599,2024-07-25 13:31:33.962887,2024-07-25 13:31:58.398927,0 days 00:00:24.436040,tanh,elu,sigmoid,0.0015642685247268353,535,437,461,COMPLETE
16,16,0.20355193316936493,2024-07-25 13:31:58.400783,2024-07-25 13:32:23.241307,0 days 00:00:24.840524,tanh,elu,sigmoid,0.007871253042336252,288,620,193,COMPLETE
17,17,0.06320508569478989,2024-07-25 13:32:23.243657,2024-07-25 13:32:48.305835,0 days 00:00:25.062178,tanh,elu,sigmoid,0.00010581310184367317,500,286,284,COMPLETE
18,18,0.05807502195239067,2024-07-25 13:32:48.307528,2024-07-25 13:33:12.308069,0 days 00:00:24.000541,elu,tanh,sigmoid,0.0002789661465820341,665,525,497,COMPLETE
19,19,0.054220594465732574,2024-07-25 13:33:12.309758,2024-07-25 13:33:36.880809,0 days 00:00:24.571051,elu,tanh,sigmoid,0.00028241440039720675,658,575,506,COMPLETE
20,20,0.060431379824876785,2024-07-25 13:33:36.885197,2024-07-25 13:34:00.434333,0 days 00:00:23.549136,elu,tanh,sigmoid,0.0003217255986687685,904,729,509,COMPLETE
21,21,0.055631160736083984,2024-07-25 13:34:00.436094,2024-07-25 13:34:22.119697,0 days 00:00:21.683603,elu,tanh,sigmoid,0.00025773001256811535,670,572,547,COMPLETE
22,22,0.05430121347308159,2024-07-25 13:34:22.121470,2024-07-25 13:34:45.772030,0 days 00:00:23.650560,elu,tanh,sigmoid,0.00021814661258890138,681,571,626,COMPLETE
23,23,0.054700758308172226,2024-07-25 13:34:45.773912,2024-07-25 13:35:10.951924,0 days 00:00:25.178012,elu,tanh,sigmoid,0.00018409630497812473,720,668,667,COMPLETE
24,24,0.048347316682338715,2024-07-25 13:35:10.953905,2024-07-25 13:35:39.223705,0 days 00:00:28.269800,elu,tanh,sigmoid,0.00018084279084207432,839,680,682,COMPLETE
25,25,0.06099826097488403,2024-07-25 13:35:39.230807,2024-07-25 13:36:07.420095,0 days 00:00:28.189288,elu,tanh,sigmoid,0.00035308746211133236,877,924,806,COMPLETE
26,26,0.07315662503242493,2024-07-25 13:36:07.422080,2024-07-25 13:36:34.731410,0 days 00:00:27.309330,elu,tanh,sigmoid,0.000758668722537515,995,848,611,COMPLETE
27,27,0.08547116816043854,2024-07-25 13:36:34.733513,2024-07-25 13:37:02.101738,0 days 00:00:27.368225,elu,tanh,sigmoid,0.0015070695838140134,816,691,666,COMPLETE
28,28,0.06483699381351471,2024-07-25 13:37:02.103729,2024-07-25 13:37:26.928673,0 days 00:00:24.824944,elu,tanh,sigmoid,0.0005672773762969178,714,562,789,COMPLETE
29,29,0.07761920988559723,2024-07-25 13:37:26.930821,2024-07-25 13:37:53.779464,0 days 00:00:26.848643,elu,tanh,tanh,0.0002054371683295234,580,1021,632,COMPLETE
30,30,0.054884590208530426,2024-07-25 13:37:53.781482,2024-07-25 13:38:20.528739,0 days 00:00:26.747257,elu,tanh,elu,0.0001705698006156532,933,783,552,COMPLETE
31,31,0.0521547794342041,2024-07-25 13:38:20.530725,2024-07-25 13:38:49.320333,0 days 00:00:28.789608,elu,tanh,sigmoid,0.00019720429811350158,720,641,677,COMPLETE
32,32,0.05260784551501274,2024-07-25 13:38:49.322310,2024-07-25 13:39:15.672980,0 days 00:00:26.350670,elu,tanh,sigmoid,0.00014471309405005134,824,619,615,COMPLETE
33,33,0.052431870251894,2024-07-25 13:39:15.675354,2024-07-25 13:39:42.278726,0 days 00:00:26.603372,elu,tanh,sigmoid,0.00015010058386151728,832,625,709,COMPLETE
34,34,0.050049252808094025,2024-07-25 13:39:42.280675,2024-07-25 13:40:07.220337,0 days 00:00:24.939662,elu,tanh,sigmoid,0.00013879670870022646,828,651,721,COMPLETE
35,35,0.04950898140668869,2024-07-25 13:40:07.222420,2024-07-25 13:40:33.342051,0 days 00:00:26.119631,elu,tanh,sigmoid,0.00014019822651231277,952,746,881,COMPLETE
36,36,0.06284987926483154,2024-07-25 13:40:33.344079,2024-07-25 13:40:58.360317,0 days 00:00:25.016238,elu,tanh,sigmoid,0.0003682576994563967,947,747,1005,COMPLETE
37,37,0.0885283499956131,2024-07-25 13:40:58.362804,2024-07-25 13:41:23.785726,0 days 00:00:25.422922,sigmoid,tanh,tanh,0.00013256132290417224,776,820,872,COMPLETE
38,38,0.05340227484703064,2024-07-25 13:41:23.787707,2024-07-25 13:41:49.349470,0 days 00:00:25.561763,elu,tanh,elu,0.0001313616110143895,943,881,805,COMPLETE
39,39,0.04916360601782799,2024-07-25 13:41:49.351486,2024-07-25 13:42:15.789751,0 days 00:00:26.438265,elu,tanh,sigmoid,0.0002044549234454334,864,673,920,COMPLETE
40,40,0.0596824549138546,2024-07-25 13:42:15.791866,2024-07-25 13:42:41.496827,0 days 00:00:25.704961,sigmoid,sigmoid,sigmoid,0.0003921669162279948,1024,696,941,COMPLETE
41,41,0.05424613878130913,2024-07-25 13:42:41.498977,2024-07-25 13:43:08.177415,0 days 00:00:26.678438,elu,tanh,sigmoid,0.00018496439525663545,894,762,865,COMPLETE
42,42,0.05744854733347893,2024-07-25 13:43:08.179506,2024-07-25 13:43:34.271902,0 days 00:00:26.092396,elu,tanh,sigmoid,0.00023927512794609312,770,669,776,COMPLETE
43,43,0.04926491156220436,2024-07-25 13:43:34.273982,2024-07-25 13:43:58.117431,0 days 00:00:23.843449,elu,tanh,sigmoid,0.00012786967302888264,841,501,907,COMPLETE
44,44,0.07781120389699936,2024-07-25 13:43:58.119482,2024-07-25 13:44:24.227873,0 days 00:00:26.108391,elu,tanh,tanh,0.00012896432870174287,854,498,921,COMPLETE
45,45,0.0486367829144001,2024-07-25 13:44:24.229985,2024-07-25 13:44:51.407967,0 days 00:00:27.177982,elu,tanh,sigmoid,0.00010206443731313983,964,483,1010,COMPLETE
46,46,0.069720059633255,2024-07-25 13:44:51.409959,2024-07-25 13:45:15.293572,0 days 00:00:23.883613,elu,sigmoid,sigmoid,0.00016724227399367398,132,460,1023,COMPLETE
47,47,0.06668921560049057,2024-07-25 13:45:15.295725,2024-07-25 13:45:40.871787,0 days 00:00:25.576062,sigmoid,tanh,sigmoid,0.00010931090403130482,976,408,961,COMPLETE
48,48,0.05769491195678711,2024-07-25 13:45:40.873758,2024-07-25 13:46:07.261991,0 days 00:00:26.388233,elu,tanh,elu,0.00010769936582559928,914,494,896,COMPLETE
49,49,0.5569124221801758,2024-07-25 13:46:07.264021,2024-07-25 13:46:32.960365,0 days 00:00:25.696344,elu,sigmoid,tanh,0.009885271100948273,964,540,831,COMPLETE
50,50,0.082687608897686,2024-07-25 13:46:32.962379,2024-07-25 13:46:58.887194,0 days 00:00:25.924815,elu,tanh,sigmoid,0.0010541833311960484,869,711,993,COMPLETE
51,51,0.050917427986860275,2024-07-25 13:46:58.889634,2024-07-25 13:47:23.742472,0 days 00:00:24.852838,elu,tanh,sigmoid,0.00013269905440525722,800,414,929,COMPLETE
52,52,0.046014245599508286,2024-07-25 13:47:23.744678,2024-07-25 13:47:48.379286,0 days 00:00:24.634608,elu,tanh,sigmoid,0.00016133445954761406,845,796,968,COMPLETE
53,53,0.06020326167345047,2024-07-25 13:47:48.386727,2024-07-25 13:48:13.392452,0 days 00:00:25.005725,elu,tanh,sigmoid,0.00017448237102469345,1016,195,964,COMPLETE
54,54,0.05745331570506096,2024-07-25 13:48:13.394197,2024-07-25 13:48:37.342722,0 days 00:00:23.948525,elu,tanh,sigmoid,0.0003002089556949034,753,815,901,COMPLETE
55,55,0.07166150957345963,2024-07-25 13:48:37.344746,2024-07-25 13:49:03.383561,0 days 00:00:26.038815,sigmoid,elu,sigmoid,0.0002391935125427152,913,773,985,COMPLETE
56,56,0.11184189468622208,2024-07-25 13:49:03.385637,2024-07-25 13:49:29.836841,0 days 00:00:26.451204,elu,tanh,sigmoid,0.003203364933984002,874,849,840,COMPLETE
57,57,0.05105940252542496,2024-07-25 13:49:29.838855,2024-07-25 13:49:56.399750,0 days 00:00:26.560895,elu,tanh,sigmoid,0.00011804666599490186,317,724,880,COMPLETE
58,58,0.047667693346738815,2024-07-25 13:49:56.401915,2024-07-25 13:50:22.979389,0 days 00:00:26.577474,elu,tanh,sigmoid,0.00010221262531440651,625,614,932,COMPLETE
59,59,0.059439580887556076,2024-07-25 13:50:22.981414,2024-07-25 13:50:49.367773,0 days 00:00:26.386359,tanh,elu,elu,0.00010038851949444619,606,599,948,COMPLETE
60,60,0.05041247233748436,2024-07-25 13:50:49.369781,2024-07-25 13:51:16.372528,0 days 00:00:27.002747,elu,sigmoid,sigmoid,0.00016302200701912847,543,375,1015,COMPLETE
61,61,0.04791649430990219,2024-07-25 13:51:16.374350,2024-07-25 13:51:41.389694,0 days 00:00:25.015344,elu,tanh,sigmoid,0.00011720768369705704,855,466,910,COMPLETE
62,62,0.04781503602862358,2024-07-25 13:51:41.391689,2024-07-25 13:52:07.582272,0 days 00:00:26.190583,elu,tanh,sigmoid,0.00011775544647991703,854,459,914,COMPLETE
63,63,0.052840281277894974,2024-07-25 13:52:07.584288,2024-07-25 13:52:33.874096,0 days 00:00:26.289808,elu,tanh,sigmoid,0.00020960080227891016,793,445,985,COMPLETE
64,64,0.045317668467760086,2024-07-25 13:52:33.876099,2024-07-25 13:53:00.156833,0 days 00:00:26.280734,elu,tanh,sigmoid,0.0001010272830096217,752,537,832,COMPLETE
65,65,0.05036165192723274,2024-07-25 13:53:00.162466,2024-07-25 13:53:26.590336,0 days 00:00:26.427870,elu,tanh,sigmoid,0.000102211905544446,749,542,750,COMPLETE
66,66,0.04985278099775314,2024-07-25 13:53:26.592549,2024-07-25 13:53:50.913618,0 days 00:00:24.321069,elu,tanh,sigmoid,0.00011455197642075687,637,598,826,COMPLETE
67,67,0.050149738788604736,2024-07-25 13:53:50.915774,2024-07-25 13:54:16.786670,0 days 00:00:25.870896,elu,tanh,sigmoid,0.00015636739819732229,682,474,970,COMPLETE
68,68,0.054532911628484726,2024-07-25 13:54:16.788742,2024-07-25 13:54:41.812026,0 days 00:00:25.023284,tanh,tanh,sigmoid,0.00011879287627114905,811,325,855,COMPLETE
69,69,0.08928088843822479,2024-07-25 13:54:41.813874,2024-07-25 13:55:07.143592,0 days 00:00:25.329718,elu,tanh,tanh,0.00015379016679117902,899,413,941,COMPLETE
70,70,0.17548955976963043,2024-07-25 13:55:07.145732,2024-07-25 13:55:33.430762,0 days 00:00:26.285030,elu,elu,sigmoid,0.005436634314706102,699,536,816,COMPLETE
71,71,0.05330165848135948,2024-07-25 13:55:33.432905,2024-07-25 13:56:01.078610,0 days 00:00:27.645705,elu,tanh,sigmoid,0.00019372559268756911,855,589,923,COMPLETE
72,72,0.05218036100268364,2024-07-25 13:56:01.080707,2024-07-25 13:56:27.290231,0 days 00:00:26.209524,elu,tanh,sigmoid,0.00022646365846987584,752,472,895,COMPLETE
73,73,0.044469695538282394,2024-07-25 13:56:27.292400,2024-07-25 13:56:52.936324,0 days 00:00:25.643924,elu,tanh,sigmoid,0.0001198074107058654,921,667,973,COMPLETE
74,74,0.047456469386816025,2024-07-25 13:56:52.942887,2024-07-25 13:57:17.654192,0 days 00:00:24.711305,elu,tanh,sigmoid,0.00011920991979013601,924,517,1022,COMPLETE
75,75,0.055812038481235504,2024-07-25 13:57:17.656207,2024-07-25 13:57:43.322789,0 days 00:00:25.666582,elu,tanh,sigmoid,0.0001488834227241491,932,558,378,COMPLETE
76,76,0.06351705640554428,2024-07-25 13:57:43.324826,2024-07-25 13:58:09.008630,0 days 00:00:25.683804,sigmoid,tanh,sigmoid,0.00012079911734057467,895,512,989,COMPLETE
77,77,0.057822585105895996,2024-07-25 13:58:09.010711,2024-07-25 13:58:31.895522,0 days 00:00:22.884811,elu,tanh,elu,0.00011742010754475325,987,641,776,COMPLETE
78,78,0.052393633872270584,2024-07-25 13:58:31.897801,2024-07-25 13:58:54.967353,0 days 00:00:23.069552,elu,tanh,sigmoid,0.00017499245937420055,840,384,966,COMPLETE
79,79,0.05060216784477234,2024-07-25 13:58:54.969332,2024-07-25 13:59:18.816046,0 days 00:00:23.846714,elu,tanh,sigmoid,0.0002676465269202867,789,432,852,COMPLETE
80,80,0.04999134689569473,2024-07-25 13:59:18.818249,2024-07-25 13:59:41.353098,0 days 00:00:22.534849,tanh,tanh,sigmoid,0.00014177831154568035,883,618,944,COMPLETE
81,81,0.048092421144247055,2024-07-25 13:59:41.355412,2024-07-25 14:00:06.978240,0 days 00:00:25.622828,elu,tanh,sigmoid,0.00010129066268049925,912,481,1021,COMPLETE
82,82,0.049006134271621704,2024-07-25 14:00:06.980321,2024-07-25 14:00:30.547833,0 days 00:00:23.567512,elu,tanh,sigmoid,0.0001242855882155932,921,522,1024,COMPLETE
83,83,0.04564223811030388,2024-07-25 14:00:30.549963,2024-07-25 14:00:56.388645,0 days 00:00:25.838682,elu,tanh,sigmoid,0.00010085667709840957,826,559,976,COMPLETE
84,84,0.05244830995798111,2024-07-25 14:00:56.390813,2024-07-25 14:01:22.678757,0 days 00:00:26.287944,elu,tanh,sigmoid,0.0001030543951289941,815,548,988,COMPLETE
85,85,0.043592266738414764,2024-07-25 14:01:22.680832,2024-07-25 14:01:47.783783,0 days 00:00:25.102951,elu,tanh,sigmoid,0.00010046392925883162,883,581,976,COMPLETE
86,86,0.049352698028087616,2024-07-25 14:01:47.790223,2024-07-25 14:02:13.676590,0 days 00:00:25.886367,elu,sigmoid,sigmoid,0.00011478415895421222,862,563,920,COMPLETE
87,87,0.07603494077920914,2024-07-25 14:02:13.678676,2024-07-25 14:02:39.572185,0 days 00:00:25.893509,elu,tanh,tanh,0.00014102906924816334,508,1017,972,COMPLETE
88,88,0.049090560525655746,2024-07-25 14:02:39.574227,2024-07-25 14:03:05.523965,0 days 00:00:25.949738,elu,tanh,sigmoid,0.00012877983517270615,843,589,885,COMPLETE
89,89,0.049882303923368454,2024-07-25 14:03:05.526042,2024-07-25 14:03:32.307662,0 days 00:00:26.781620,elu,tanh,sigmoid,0.00015910848757666362,732,511,945,COMPLETE
90,90,0.056150615215301514,2024-07-25 14:03:32.309780,2024-07-25 14:03:56.820295,0 days 00:00:24.510515,elu,tanh,sigmoid,0.00011482381198995666,231,615,999,COMPLETE
91,91,0.04903142526745796,2024-07-25 14:03:56.822519,2024-07-25 14:04:21.621912,0 days 00:00:24.799393,elu,tanh,sigmoid,0.00010167004029535496,886,462,1005,COMPLETE
92,92,0.04887869954109192,2024-07-25 14:04:21.624009,2024-07-25 14:04:47.904569,0 days 00:00:26.280560,elu,tanh,sigmoid,0.00013604840901503457,931,488,909,COMPLETE
93,93,0.061211030930280685,2024-07-25 14:04:47.906709,2024-07-25 14:05:13.608655,0 days 00:00:25.701946,elu,tanh,sigmoid,0.00011138596924918091,907,442,970,COMPLETE
94,94,0.04731317237019539,2024-07-25 14:05:13.610700,2024-07-25 14:05:39.558331,0 days 00:00:25.947631,elu,tanh,sigmoid,0.00012541765015165184,963,656,934,COMPLETE
95,95,0.0471096970140934,2024-07-25 14:05:39.560434,2024-07-25 14:06:05.815471,0 days 00:00:26.255037,elu,tanh,sigmoid,0.0001260958882388543,965,656,933,COMPLETE
96,96,0.0810287818312645,2024-07-25 14:06:05.817621,2024-07-25 14:06:31.885536,0 days 00:00:26.067915,sigmoid,elu,sigmoid,0.00014956914966442132,967,664,938,COMPLETE
97,97,0.05758587270975113,2024-07-25 14:06:31.887664,2024-07-25 14:06:58.035935,0 days 00:00:26.148271,elu,tanh,elu,0.00018466765692397576,1012,689,868,COMPLETE
98,98,0.07829233258962631,2024-07-25 14:06:58.038081,2024-07-25 14:07:24.235966,0 days 00:00:26.197885,elu,tanh,sigmoid,0.0005595292609110999,991,653,953,COMPLETE
99,99,0.05096287280321121,2024-07-25 14:07:24.238011,2024-07-25 14:07:51.099077,0 days 00:00:26.861066,elu,tanh,sigmoid,0.00012739972454165328,945,701,979,COMPLETE
